mp_id,assistant_fullname,assistant_type_id
21162,Денис Мирослав Михайлович,4
21163,Гетьман Євген Iй Серг Iйович,2
21163,Чабанова Тетяна Серг Iївна,4
21163,Запорожець Ольга Серг Iївна,2
21163,Козачок Оксана Миколаївна,2
21163,Бондар Олександр  Iванович,4
21164,Пекарь Олександр В Iкторович,4
21164,Трикур Євген Юр Iйович,4
21164,Ковальчук Олександр Володимирович,4
21164,Кучерява Зореслава  Iван Iвна,4
21164,Волошин Ярослав  Iванович,4
21164,Хал Iмон Галина Васил Iвна,4
21164,Понзель Василь Васильович,4
21164,Грабар Серг Iй Володимирович,4
21164,Катринець Василь Васильович,4
21164,Агаєв Рустам  Iлгарович,2
21164,Фекийшгаз I Кр Iст Iан Степанович,2
6073,Непопенко Катерина Васил Iвна,2
6073, Iщенко Галина  Iван Iвна,2
6073,Троханчук Дмитро  Iванович,4
6073,Гор Iн Артур Володимирович,4
6073,Романовський Олександр Олександрович,4
6073,Кондратюк Серг Iй Володимирович,2
21166,Мельникова Тамара В Iктор Iвна,4
21166,Крєс Андр Iй Васильович,2
21166,Гладкий Дмитро В Iкторович,4
21166,Стойчев Валер Iй Михайлович,4
21166,Капустянський Юр Iй В Iкторович,4
21166,Брензей Олена Олег Iвна,4
15649,Тустановська  Iванна Андр Iївна,2
15649,Грицьк Iв Роман Ярославович,4
15649,К Iсенко Андр Iй Миколайович,4
21168,Завгородн Iй Владислав Валер Iйович,4
21168,Опалько Максим Едуардович,4
21168,Ковердяга  Iгор Миколайович,4
21168,Безбах Владислав Серг Iйович,4
21168,Буйн Iстрович  Iнна В Iктор Iвна,2
21168,Ос Iєвська  Iрина Васил Iвна,4
21169, Iванов Олександр Юр Iйович,4
21169,Шверк Юр Iй Аронович,4
21169, Iвон Iн Михайло Володимирович,4
21169, Iванов Денис Владиславович,4
21169,Чернишов Серг Iй Володимирович,4
21169,Андрейк Iв-Морозова Оксана Олександр Iвна,4
21169,Ковальова Марина В Iктор Iвна,4
21169,Терновська Мар Iя Леонт Iївна,4
21169,Кравцова Янна Едуард Iвна,2
21169,Авалян Єрванд Володимирович,2
21169,Заблодська  Iнна Володимир Iвна,4
21169,Шевченко Дмитро Серг Iйович,4
21169, Iвченко Євген Анатол Iйович,4
21169,Шахов Серг Iй Вячеславович,4
21170,Чередн Iченко Лариса В Iктор Iвна,4
21170,Юлдашев Олекс Iй Хашимович,4
21170,Отрош  Iнна Олекс Iївна,2
21170,Сисак Владислав Тарасович,4
21170,Захаров Артем Вячеславович,4
21170,Спектор Ольга Михайл Iвна,4
21171,М Iлют Iн Андр Iй Володимирович,4
21171,Данищук Олександр Миколайович,4
21171,Прокоф'єва Св Iтлана  Iван Iвна,4
21171,Вавженчук Олена Валер Iївна,4
21171,Л Iп Iнська Людмила  Iван Iвна,4
21171,Касянчук Серг Iй В Iкторович,4
21171,Мошк Iвський Руслан В Iкторович,4
21171,Караван Руслан Володимирович,4
21171,Нор Олександр Петрович,4
21171,Зубець Олександр Павлович,4
21171,Гончаренко Олег В Iкторович,4
21171,Засенко Вячеслав Миколайович,4
21171,Швидка Жанна Петр Iвна,2
21171,Волк Iвський Микола Анатол Iйович,2
21171,Живцов Олександр Миколайович,4
15804,Бобрицький Леон Iд Володимирович,4
15804,Коротич Натал Iя Григор Iвна,4
15804,Шипко Володимир Андр Iйович,4
15804,Кришталь Альона Олекс Iївна,4
15804,Кошара Олександр Володимирович,4
15804,Вишневський  Iгор Васильович,4
15804,Лелюк Любов  Iван Iвна,4
15804,Турчин В Iтал Iй Олекс Iйович,4
15804,Ємець В Iктор Iя Михайл Iвна,4
15804,Мовчан Юл Iя В Iтал Iївна,4
15804,Мацейко В Iктор Васильович,4
15804,Хрипко Серг Iй Володимирович,2
15804,Нерода Юл Iя Юр Iївна,2
21172,Лиман  Iрина Миколаївна,4
21172,Борисенко Тетяна Аркад Iївна,4
21172,Герасимчук Тетяна В Iктор Iвна,3
21173,Яценко Вячеслав Петрович,2
21173,Журба В Iтал Iй Анатол Iйович,2
21174,Тимоф Iйчук Володимир Павлович,4
21174,Плужн Iков Михайло Брон Iславович,2
21174,Н Iконов Дмитро Анатол Iйович,4
21174,Бр Iджендра,4
18112,Бродн Iкова Тетяна Володимир Iвна,2
18112,Мороз Павло Андр Iйович,4
18112,Стоянов Серг Iй Васильович,4
18112,Щ Iпановський Олександр Олекс Iйович,4
18112,Граб Роман Анатол Iйович,4
18112,Д Iдух Мар Iя Миколаївна,4
18112,Сп Iльн Iченко Ольга Олександр Iвна,4
18112,Лось Дмитро Георг Iйович,4
18112,Авсєєвич Анастас Iя Костянтин Iвна,4
18112,Нарожна Мар'яна Олександр Iвна,2
2287,Козленко Анатол Iй Михайлович,4
2287,Мазурчук Лариса Леон Iд Iвна,2
2287,Пал Iй Любов В Iктор Iвна,4
2287,Скоропад  Iгор Михайлович,4
2287,Легомина Владислав Валер Iйович,4
2287,Бервецький Володимир Федорович,4
2287,Бабенко Григор Iй  Iванович,4
2287,Чорний Михайло Миколайович,2
2287,Чорний Микола Михайлович,2
2287,Морозов Володимир Григорович,4
2287,Чорна Над Iя Петр Iвна,4
2287,Якимчук Микола Андр Iйович,4
2287,Диковицький Ярослав Григорович,4
21190,Доценко Артур Євген Iйович,4
21190,Сидоренко Олександр Леон Iдович,4
21190,Капустянський Василь Борисович,4
21190,Єрмолаєв В Iктор Миколайович,4
21190,Кукушк Iн  Iван Анатол Iйович,4
21190,Мухай Володимир В Iкторович,4
21190,Дарчич В Iтал Iй Олекс Iйович,4
21190,Миронова Л Iна Валер Iївна,4
21190,Ємець Дарина Вадим Iвна,4
21190,М Iщенко Денис Олександрович,4
21190,Новак Леон Iд Володимирович,4
21190,Шабала  Iрина Вадим Iвна,2
21190,Целуйко Дар'я Серг Iївна,2
21190,Капущак  Iванна Серг Iївна,2
21191,Дигун Михайло Володимирович,2
21191,Кононенко Серг Iй В Iкторович,4
21191,Вербенська Над Iя Михайл Iвна,4
21191,Замша Олександр Серг Iйович,4
21191,Бєлова Ганна  Iгор Iвна,4
21176,Чорн Iй  Iгор  Iгорович,2
21176,Бонь Андр Iй Михайлович,4
21176,Мигович Тетяна Дмитр Iвна,4
21176,Бондар Дарина Володимир Iвна,4
21176,Давидов Андр Iй Серг Iйович,2
21176,Чумаченко Яна Васил Iвна,4
21176,Куштан Альона Васил Iвна,4
21176,Гриб Юл Iана В Iктор Iвна,4
21176,Собран Юл Iя Олег Iвна,4
21176,Суханов Руслан Валер Iйович,4
21176,Сочка Микола  Iванович,4
21176,Микул Iн Микола Миколайович,4
21176,Слюсарчук Ольга Петр Iвна,4
21176,Горзов Петро Володимирович,4
21176,К Iштулинець Рад Iон Володимирович,4
21176,Рояк Роберт Степанович,4
21176,Лашкай  Iван  Iванович,4
21176,Шкирта Тарас Михайлович,4
21176,Чийпеш  Iван  Iванович,4
21176,Яцьк Iв Т Iбор Лайошович,4
21176,Собран Михайло Васильович,4
15824,Дрозд Олександр Анатол Iйович,4
15824,Шудра Богдан Михайлович,4
15824,Ткач Юр Iй Олександрович,4
15824,Смалюх Iвська Ольга Олександр Iвна,4
15824,Музика Анна Володимир Iвна,2
15824,Павличенко Данило Петрович,2
8806, Iванов Серг Iй Богданович,2
8806,Можар Iвський Леон Iд Володимирович,4
8806,Н Iк Iт Iна В Iктор Iя В Iктор Iвна,4
8806,Гал Iмський Олекс Iй Валер Iйович,4
8806,Кавун Валер Iй Карпович,4
8806,Мороз Юл Iя Анатол Iївна,4
8806,Сорока В Iтал Iй Анатол Iйович,4
8806,Дорошенко В Iктор Олегович,4
8806,Кал Iн Iченко Серг Iй Васильович,4
8806,Логвин Св Iтлана Володимир Iвна,2
2179,Курчинська Ольга Миколаївна,2
2179,Вишневська Валентина Юл Iївна,2
2179,Клочко Дмитро Аркад Iйович,2
2179,Олещенко Серг Iй Михайлович,4
2179,Гриненко Роман Миколайович,4
2179,Красюк Тетяна Миколаївна,4
2179, Iльченко Л Iра Володимир Iвна,2
2179,Карпов Олександр Олександрович,4
2179,Костюк Маргарита Анатол Iївна,4
21185,Яцишена Ганна Анатол Iївна,4
21185,Бутова Галина Олег Iвна,4
21185,Козаченко Олена Володимир Iвна,2
21186,С Iтковський Роман Валентинович,2
21186,Костенко Тетяна В Iктор Iвна,4
21186,Тимошенко Андр Iй Володимирович,4
21186,Хотенко Олена Анатол Iївна,4
21187,Лазоренко Дмитро Миколайович,4
21187,Кув Iла Олександр  Iванович,4
21187,Клим Павло Миколайович,4
21187,Гнатюк Альона В Iктор Iвна,4
21187,Васильєв Єгор Володимирович,4
21187,Пятн Iцький Анатол Iй Олександрович,4
21187,Раца Олена Анатол Iївна,4
21187,Семенюк Антон Валер Iйович,4
21187,Чорна Альона Володимир Iвна,4
21187,Зрибнєва  Iрина Павл Iвна,4
21187,Марараш Денис В Iкторович,4
21187,Савєльєв Серг Iй Павлович,4
21187,Медведєва Людмила Миколаївна,4
21187,Гончаренко Мар Iя Євген Iвна,2
21187,Омельченко Оксана Анатол Iївна,2
21187,Томак Микола Олекс Iйович,4
21189,Фещенко Тетяна Петр Iвна,2
21189,Бродич  Iрина Валер Iївна,2
21189,Мичка Андр Iй  Iванович,4
21189,Коренчук Андр Iй Арнольдович,4
21189,Хал Iмон Оксана Анатол Iївна,4
21189,Савонов Валер Iй Васильович,4
21189,Ткач Лариса Володимир Iвна,2
21189,Плескач  Iрина Адам Iвна,4
21192,Хлєбн Iков Володимир Олекс Iйович,4
21192,Б Iль Владислав Серг Iйович,4
21192,Гункевич Остап Богданович,4
21192,Кондра Д Iана Богдан Iвна,4
21192,Антк Iв Володимир Васильович,4
21192,Лузан Андр Iй В Iкторович,2
21192,Кочерга Олександр Петрович,2
8815,Грись  Iван Михайлович,4
8815,Герей Василь Лук Iянович,4
8815,Войтовська  Iрина Леон Iд Iвна,2
8815,Нижний Валер Iй  Iванович,2
8815,Лесько Галина Ярослав Iвна,4
8815,Гнатенко Натал Iя Григор Iвна,2
8815,К Iра  Iрина  Iван Iвна,4
8815,Карп Iнець Андр Iй Юр Iйович,4
8815,Мєзєнцев Микола Леон Iдович,4
8815,Свистун  Iгор  Iлл Iч,2
18116,Буряк Тетяна Юр Iївна,2
18116,Майборода Ганна Анатол Iївна,2
18116,Проценко Натал Iя Павл Iвна,2
18116,Трикоз Тетяна Андр Iївна,2
18116,Ч Iл Iб I Натал Iя Володимир Iвна,2
18116,Барабаш Ганна Вадим Iвна,4
18116,Власюк Юл Iя Олександр Iвна,4
18116,Стрепоченко Ольга Миколаївна,2
18116,Вервейко  Iван Дмитрович,2
18116,Стич Iнський Олександр Францович,2
18116,Колобродова Олена Володимир Iвна,2
18116,Кононенко Денис Олександрович,2
18116,Ващук Владислав В Iкторович,4
18116,Чуп Iс Анастас Iя Дмитр Iвна,4
21193,Казацький Владислав Дмитрович,4
21193,Б Iльчук  Iнна Миколаївна,4
21193,Аксак  Iнна Михайл Iвна,4
21193,Крамарєва Олена Володимир Iвна,4
21193,Пал Iєнко  Iгор Володимирович,4
21193,С Iб Iльов Денис Михайлович,4
21193,Даньшин Максим Валер Iйович,4
21193,Яценко Вячеслав Олександрович,4
21193,Гусаров Костянтин Володимирович,4
21193,Чернявська Ольга Михайл Iвна,2
21193,Солодкий Олекс Iй Анатол Iйович,2
21193,Проскурова Юл Iя Васил Iвна,2
15662,Боднар Роман Васильович,4
15662,Почотний Юр Iй Костянтинович,4
15662,Сухляк Тетяна Геннад Iївна,4
15662,Чег Iль Мар Iя Володимир Iвна,2
15662,Дир Iв Арсен Анатол Iйович,2
15662,П Iпаш Неля Михайл Iвна,2
15662,Маринц Iвський Мирослав Михайлович,4
15662,Овсян Iкова Анн Iта Олександр Iвна,2
15662,Глиба  Iван  Iванович,4
15662,Севч Оксана  Iван Iвна,4
15662,Микитюк Єгор Миколайович,4
15662,Куртинець Олександр Семенович,4
15662, Iлтьо Едуард Михайлович,4
15662,Гарагонич  Iван Васильович,4
15662,Картавих Нелл I Серг Iївна,2
15662,Кричфалуш Iй Володимир Васильович,2
7718,Стародубцева Наталя Георг Iївна,2
7718,Шелест Євген Федорович,4
7718,Котенко Дмитро Олекс Iйович,4
7718,Романенко Олександр Григорович,4
7718,Кошова Олеся  Iван Iвна,2
7718,Приходько Натал Iя В Iктор Iвна,4
11109,Клопот Олег Миколайович,4
11109,Волкова  Iнна  Iгор Iвна,2
11109,Футорянська Катерина Павл Iвна,2
11109,Коваленко Вячеслав Петрович,2
11109,Кутуєва  Iрина Олександр Iвна,4
11109,Н Iк Iтчина Зореслава Михайл Iвна,4
21194,Бахт Iна Еллада Армаїс Iвна,4
21194,Закопайло Олександр Валентинович,4
21194,Бесед Iн Андр Iй Олександрович,4
21194,Закопайло Артем Олександрович,4
21194,Мамалига Олена Олекс Iївна,4
21194,Кутовий Олекс Iй Валер Iйович,4
21194,Еверт Олеся Юр Iївна,2
21194,Зимовець Серг Iй Валентинович,3
21194,Редько Олександр Романович,2
18117,Бровар Людмила Миколаївна,2
18117,Драгун Тетяна Анатол Iївна,4
18117,Павлишин  Iгор Володимирович,2
21195,Рудяк Влад Iм Iра Олександр Iвна,4
21195,Дем'яновська Юл Iя Григор Iвна,4
21195,Погребняк Лариса Миколаївна,4
21195,Подорожняк В Iтал Iй В Iкторович,4
21195,Сухонос Натал Iя Васил Iвна,4
21195,Павленко  Iнна Вячеслав Iвна,2
21195,Янковець Анастас Iя Валер Iївна,2
21195,Савка Ал Iна Олег Iвна,2
21195,Брат Iк Серг Iй В Iкторович,4
21252,Стецюк Дмитро Валер Iйович,4
21252,Костюченко Олекс Iй Олександрович,4
21252,Маринич Микола Михайлович,4
21252,Йовж Iй Олександр Михайлович,4
21252,Голубенко Валентин Леон Iдович,4
21252,Климець Натал Iя Максим Iвна,4
21252,Базака  Iрина Олександр Iвна,4
21252,Янк Iвський Роман Юр Iйович,4
21252,Базака Богдан Степанович,4
21252,Омельяненко Валер Iй Олександрович,4
21252,Чижевський Олександр Павлович,4
21252,Тарасенко Лариса  Iван Iвна,2
21252,Куз Iн Олександр В Iкторович,4
21252,Жук Натал Iя Степан Iвна,4
21252,Кулакевич Валентина Миколаївна,4
21252,Сиротюк Петро Миколайович,4
21252,Тутевич Володимир Максимович,4
21252,Базака Юл Iя Степан Iвна,2
21252,Климець Микола Андр Iйович,4
21237,Хмельницький Олександр Львович,4
21237,Скаб Iна Натал Iя Петр Iвна,4
21237,Мо Iсеєнко Катерина Олександр Iвна,4
21237,Кюрчев Володимир Миколайович,4
21237,Кузьменко Андр Iй Григорович,4
21237,Євтушенко Христина Едуард Iвна,4
21237,Євдокименко Євген Миколайович,4
21237,Євдокименко Микола Михайлович,4
21237,Стадн Iчук Руслан Олегович,4
21237,Т Iмофєєв Павло Анатол Iйович,2
21237,Корнєв Євген Олександрович,4
21196,Каурк Iна Св Iтлана Валер Iївна,2
21196,Александрова Олена В Iктор Iвна,2
21196,Сапун Серг Iй Васильович,2
21196,Лар Iонов Олександр Олекс Iйович,4
21196,Л Iпкан Анатол Iй Васильович,4
21197,М Iненко Юл Iя Юр Iївна,4
21197,Матв Iєнко Олег В Iкторович,4
21197,Муравйова Юл Iя Дмитр Iвна,2
21197,Кизило Ганна Юр Iївна,2
21197,Бород Iна Тетяна Олександр Iвна,2
21198,Завадовський Володимир Адамович,4
21198,Б Iлик Валентин Володимирович,4
21198,Дякон Олександр  Iванович,4
21198,Дякон Валентин Михайлович,4
21198,Князєв Антон Iй Михайлович,4
21198,Стрельчук Прокоп Iй Григорович,4
21198,Аграт Iна Серг Iй Антонович,4
21198,Лазоренко Андр Iй Миколайович,4
21198,П Iкул Iн Олександр Серг Iйович,4
21198,Кал Iшенко Галина Миколаївна,2
21198, Iгнатов Едуард Євгенович,4
21198,Крайнюк Олег Борисович,4
21198,С Iрман Дмитро Онуфр Iйович,4
21198,Б Iл Iчук Василь  Iванович,4
21198,Башликова В Iктор Iя Артур Iвна,4
21198,Гешко  Iван Тарасович,3
21198,Страт Iйчук Петро Миколайович,2
21198,Головльов Анатол Iй Миколайович,2
21198,Онофриєсе Людмила Михайл Iвна,4
21198,Лупу Натал Iя Олекс Iївна,2
21198,Стець  Iгор Олександрович,4
21198,Павзюк Олег В Iкторович,4
21198,Мазурашу Михайло Георг Iйович,4
21198,Тарасенко В Iтал Iй Олександрович,4
21199,Василенко  Iнна Миколаївна,2
21199,Хоровецька Алла В Iктор Iвна,4
21199,Джердж Тарас В Iтал Iйович,2
21199,Чермак  Iгор  Iванович,4
21200,Жуков Микита Серг Iйович,4
21200,Деркач Дмитро Анатол Iйович,4
21200,Сергеєва Анастас Iя Васил Iвна,2
21200,Пашинський Анатол Iй Павлович,4
21200,Вовк Мирослав Тарасович,2
21203,Джердж В Iтал Iй Федорович,2
21203,Козич В Iтал Iй Олександрович,2
21203,Пластун Михайло Серг Iйович,4
21203,Голодов Едуард Анатол Iйович,4
21203,М Iзько Натал Iя Наум Iвна,2
21203,Левченко Людмила Серг Iївна,2
21217,Толстоухов Серг Iй В Iкторович,2
21217,Мельник Роман Миколайович,2
21217,М Iкул Iч  Iрина Антон Iвна,2
21217,Березинський Володимир Павлович,4
21217,Михайленко Олекс Iй Миколайович,4
21217,Семенченко В Iтал Iй Миколайович,4
21217,Кушн Iренко Павло Борисович,4
21217,Крохмаль Володимир Миколайович,4
21217,Бутенко В Iтал Iй Миколайович,4
21217,Дарв Iш Абдулвахаб Фах Iм,4
21932,Яхнович Юр Iй Юр Iйович,2
21932,Кропивницький В Iтал Iй В Iкторович,2
21932,Погребняк Мар Iя Володимир Iвна,2
21932,Кондратюк Галина Васил Iвна,2
21932,Мал Iнський Богдан Миколайович,4
21932,Зеленецький Вадим Олександрович,4
21932,Поворознюк Євген Iй Євген Iйович,4
21932,Ткаченко Тетяна Миколаївна,4
21932,Н Iг Iрчук Олександр Стан Iславович,4
21932,Лемешко Серг Iй Анатол Iйович,4
21932,Пас Iчник В Iтал Iй В Iкторович,4
21932,Шкабара Олег  Iванович,4
21932,Яковенко Серг Iй Євгенович,4
21218,Фасоль Олена Олег Iвна,4
21218,Н Iк Iт Iн Андр Iй Володимирович,4
21218,Косоуров Кирило Володимирович,4
21218,Довгаль Олександр  Iванович,4
21218,Сарамага Роман Костянтинович,4
21218,Кабала  Iрина В Iктор Iвна,4
21218,Вусик Олена В Iктор Iвна,4
21218,Зарудна Анна Серг Iївна,2
21218,Борейко Володимир Євгенович,4
21218,Нел Iпа Андр Iй Володимирович,4
21218,Волков Серг Iй Степанович,4
21219,Марусяк Олекс Iй Степанович,4
21219,Дутка-Гефко Христина Миколаївна,2
21219,Гук Володимир Олександрович,4
21219,Дутка Роман Васильович,2
21219,Безрукий Руслан Ярославович,4
21219,Юрчишин Олег Михайлович,4
21220,Компанець Пол Iна Олекс Iївна,2
21220,Мариновська Олена Олекс Iївна,4
21220,Крисоватий  Iгор Андр Iйович,4
21220,Колесн Iк Анастас Iя Васил Iвна,2
21221,Дяконов Олександр В Iкторович,2
21221,Шевченко Тарас Миколайович,4
21221,Дудзяк Руслан В Iтал Iйович,4
21221,Улиганець В Iктор Iя Євген Iвна,3
21223,Бондаренко  Iванна Георг Iївна,2
21223,Новицький Василь Петрович,4
21223,Кокоць Серг Iй Юр Iйович,4
21223,Калин Iй Василь Володимирович,4
21223,Дзекунова Євген Iя Олександр Iвна,2
21223,Бриндальський Андр Iй Петрович,2
1934,Д Iдан Тетяна Миколаївна,4
1934,Куцевалов Валер Iй В Iтал Iйович,4
